{
  "baseline_owner_approval": "pending",
  "committed_ci": {
    "artifact_name": "chromium-sentinel-calibration-29260372260-18229be570766d3b42f5600955120bfcba690b76",
    "checkout_sha": "18229be570766d3b42f5600955120bfcba690b76",
    "execution_repository": "ark-jo/StyleGallery",
    "head_sha": "3bfdd25ec9a2df4ca84e19541365d48842a73f59",
    "raw_evidence_sha256": "1f125d5b321063b364e19283897c78c126d73eb1b3368d14686c494b1296dfab",
    "repository": "changeroa/StyleGallery",
    "run_attempt": "1",
    "run_id": "29260372260",
    "sha": "18229be570766d3b42f5600955120bfcba690b76",
    "workflow": ".github/workflows/validate.yml",
    "external_verification": {
      "artifact": {
        "api_digest": "sha256:3f11a517b447e1b5a1da17d9ee66ba2dd947fc8a0a482c447556ef00652e6074",
        "expires_at": "2026-07-27T15:01:36Z",
        "id": "8283099324",
        "name": "chromium-sentinel-calibration-29260372260-18229be570766d3b42f5600955120bfcba690b76",
        "size_in_bytes": 70310
      },
      "repository_relationship": {
        "execution_is_fork": true,
        "parent": "changeroa/StyleGallery",
        "source": "changeroa/StyleGallery"
      },
      "source": "https://github.com/ark-jo/StyleGallery/actions/runs/29260372260",
      "verified_at": "2026-07-13T15:04:41Z"
    }
  },
  "environment": {
    "architecture": "amd64",
    "browser_revision": "1228",
    "browser_version": "149.0.7827.55",
    "container_image": "mcr.microsoft.com/playwright:v1.61.0-noble@sha256:57b65fdc9ceabe0ef613124c7bbe2babcf9362c4d85e382fe3b03604e84b428a",
    "node": "22",
    "os": "Ubuntu 24.04",
    "platform": "linux/amd64",
    "playwright": "1.61.0",
    "viewport": {
      "height": 768,
      "width": 1024
    }
  },
  "required_runs": 20,
  "reference": {
    "baseline": {
      "path": "tests/snapshots/consumer-reference-card-grid.png",
      "sha256": "5528358e957a6115793155e501f62716f7db31dc1c86856d9e1234868d672837"
    },
    "source": {
      "path": "tests/helpers/render-consumer-reference.mjs",
      "sha256": "88802a948909d5e40470be6b5481766ce2de498e59c053ac68af370b46e72ca9"
    }
  },
  "runs": [
    {
      "architecture": "amd64",
      "ax_sha256": "def6b05ea534a76b5362a436642f9790e464b4c6489a23118ff60b5eaee3aa1b",
      "completed": true,
      "dom_sha256": "ea28521d6b2e6b6d38b80a3a0411bddfd55da5f015b46271737c21c7f4098bb1",
      "metadata_sha256": "43a98d03b473e29c78ba2d359cf5f39346288d55564e5bfe65bc4a4fd78ebc2c",
      "png_sha256": "5528358e957a6115793155e501f62716f7db31dc1c86856d9e1234868d672837",
      "run": 1,
      "screenshot_diff_pixels": 0
    },
    {
      "architecture": "amd64",
      "ax_sha256": "def6b05ea534a76b5362a436642f9790e464b4c6489a23118ff60b5eaee3aa1b",
      "completed": true,
      "dom_sha256": "ea28521d6b2e6b6d38b80a3a0411bddfd55da5f015b46271737c21c7f4098bb1",
      "metadata_sha256": "43a98d03b473e29c78ba2d359cf5f39346288d55564e5bfe65bc4a4fd78ebc2c",
      "png_sha256": "5528358e957a6115793155e501f62716f7db31dc1c86856d9e1234868d672837",
      "run": 2,
      "screenshot_diff_pixels": 0
    },
    {
      "architecture": "amd64",
      "ax_sha256": "def6b05ea534a76b5362a436642f9790e464b4c6489a23118ff60b5eaee3aa1b",
      "completed": true,
      "dom_sha256": "ea28521d6b2e6b6d38b80a3a0411bddfd55da5f015b46271737c21c7f4098bb1",
      "metadata_sha256": "43a98d03b473e29c78ba2d359cf5f39346288d55564e5bfe65bc4a4fd78ebc2c",
      "png_sha256": "5528358e957a6115793155e501f62716f7db31dc1c86856d9e1234868d672837",
      "run": 3,
      "screenshot_diff_pixels": 0
    },
    {
      "architecture": "amd64",
      "ax_sha256": "def6b05ea534a76b5362a436642f9790e464b4c6489a23118ff60b5eaee3aa1b",
      "completed": true,
      "dom_sha256": "ea28521d6b2e6b6d38b80a3a0411bddfd55da5f015b46271737c21c7f4098bb1",
      "metadata_sha256": "43a98d03b473e29c78ba2d359cf5f39346288d55564e5bfe65bc4a4fd78ebc2c",
      "png_sha256": "5528358e957a6115793155e501f62716f7db31dc1c86856d9e1234868d672837",
      "run": 4,
      "screenshot_diff_pixels": 0
    },
    {
      "architecture": "amd64",
      "ax_sha256": "def6b05ea534a76b5362a436642f9790e464b4c6489a23118ff60b5eaee3aa1b",
      "completed": true,
      "dom_sha256": "ea28521d6b2e6b6d38b80a3a0411bddfd55da5f015b46271737c21c7f4098bb1",
      "metadata_sha256": "43a98d03b473e29c78ba2d359cf5f39346288d55564e5bfe65bc4a4fd78ebc2c",
      "png_sha256": "5528358e957a6115793155e501f62716f7db31dc1c86856d9e1234868d672837",
      "run": 5,
      "screenshot_diff_pixels": 0
    },
    {
      "architecture": "amd64",
      "ax_sha256": "def6b05ea534a76b5362a436642f9790e464b4c6489a23118ff60b5eaee3aa1b",
      "completed": true,
      "dom_sha256": "ea28521d6b2e6b6d38b80a3a0411bddfd55da5f015b46271737c21c7f4098bb1",
      "metadata_sha256": "43a98d03b473e29c78ba2d359cf5f39346288d55564e5bfe65bc4a4fd78ebc2c",
      "png_sha256": "5528358e957a6115793155e501f62716f7db31dc1c86856d9e1234868d672837",
      "run": 6,
      "screenshot_diff_pixels": 0
    },
    {
      "architecture": "amd64",
      "ax_sha256": "def6b05ea534a76b5362a436642f9790e464b4c6489a23118ff60b5eaee3aa1b",
      "completed": true,
      "dom_sha256": "ea28521d6b2e6b6d38b80a3a0411bddfd55da5f015b46271737c21c7f4098bb1",
      "metadata_sha256": "43a98d03b473e29c78ba2d359cf5f39346288d55564e5bfe65bc4a4fd78ebc2c",
      "png_sha256": "5528358e957a6115793155e501f62716f7db31dc1c86856d9e1234868d672837",
      "run": 7,
      "screenshot_diff_pixels": 0
    },
    {
      "architecture": "amd64",
      "ax_sha256": "def6b05ea534a76b5362a436642f9790e464b4c6489a23118ff60b5eaee3aa1b",
      "completed": true,
      "dom_sha256": "ea28521d6b2e6b6d38b80a3a0411bddfd55da5f015b46271737c21c7f4098bb1",
      "metadata_sha256": "43a98d03b473e29c78ba2d359cf5f39346288d55564e5bfe65bc4a4fd78ebc2c",
      "png_sha256": "5528358e957a6115793155e501f62716f7db31dc1c86856d9e1234868d672837",
      "run": 8,
      "screenshot_diff_pixels": 0
    },
    {
      "architecture": "amd64",
      "ax_sha256": "def6b05ea534a76b5362a436642f9790e464b4c6489a23118ff60b5eaee3aa1b",
      "completed": true,
      "dom_sha256": "ea28521d6b2e6b6d38b80a3a0411bddfd55da5f015b46271737c21c7f4098bb1",
      "metadata_sha256": "43a98d03b473e29c78ba2d359cf5f39346288d55564e5bfe65bc4a4fd78ebc2c",
      "png_sha256": "5528358e957a6115793155e501f62716f7db31dc1c86856d9e1234868d672837",
      "run": 9,
      "screenshot_diff_pixels": 0
    },
    {
      "architecture": "amd64",
      "ax_sha256": "def6b05ea534a76b5362a436642f9790e464b4c6489a23118ff60b5eaee3aa1b",
      "completed": true,
      "dom_sha256": "ea28521d6b2e6b6d38b80a3a0411bddfd55da5f015b46271737c21c7f4098bb1",
      "metadata_sha256": "43a98d03b473e29c78ba2d359cf5f39346288d55564e5bfe65bc4a4fd78ebc2c",
      "png_sha256": "5528358e957a6115793155e501f62716f7db31dc1c86856d9e1234868d672837",
      "run": 10,
      "screenshot_diff_pixels": 0
    },
    {
      "architecture": "amd64",
      "ax_sha256": "def6b05ea534a76b5362a436642f9790e464b4c6489a23118ff60b5eaee3aa1b",
      "completed": true,
      "dom_sha256": "ea28521d6b2e6b6d38b80a3a0411bddfd55da5f015b46271737c21c7f4098bb1",
      "metadata_sha256": "43a98d03b473e29c78ba2d359cf5f39346288d55564e5bfe65bc4a4fd78ebc2c",
      "png_sha256": "5528358e957a6115793155e501f62716f7db31dc1c86856d9e1234868d672837",
      "run": 11,
      "screenshot_diff_pixels": 0
    },
    {
      "architecture": "amd64",
      "ax_sha256": "def6b05ea534a76b5362a436642f9790e464b4c6489a23118ff60b5eaee3aa1b",
      "completed": true,
      "dom_sha256": "ea28521d6b2e6b6d38b80a3a0411bddfd55da5f015b46271737c21c7f4098bb1",
      "metadata_sha256": "43a98d03b473e29c78ba2d359cf5f39346288d55564e5bfe65bc4a4fd78ebc2c",
      "png_sha256": "5528358e957a6115793155e501f62716f7db31dc1c86856d9e1234868d672837",
      "run": 12,
      "screenshot_diff_pixels": 0
    },
    {
      "architecture": "amd64",
      "ax_sha256": "def6b05ea534a76b5362a436642f9790e464b4c6489a23118ff60b5eaee3aa1b",
      "completed": true,
      "dom_sha256": "ea28521d6b2e6b6d38b80a3a0411bddfd55da5f015b46271737c21c7f4098bb1",
      "metadata_sha256": "43a98d03b473e29c78ba2d359cf5f39346288d55564e5bfe65bc4a4fd78ebc2c",
      "png_sha256": "5528358e957a6115793155e501f62716f7db31dc1c86856d9e1234868d672837",
      "run": 13,
      "screenshot_diff_pixels": 0
    },
    {
      "architecture": "amd64",
      "ax_sha256": "def6b05ea534a76b5362a436642f9790e464b4c6489a23118ff60b5eaee3aa1b",
      "completed": true,
      "dom_sha256": "ea28521d6b2e6b6d38b80a3a0411bddfd55da5f015b46271737c21c7f4098bb1",
      "metadata_sha256": "43a98d03b473e29c78ba2d359cf5f39346288d55564e5bfe65bc4a4fd78ebc2c",
      "png_sha256": "5528358e957a6115793155e501f62716f7db31dc1c86856d9e1234868d672837",
      "run": 14,
      "screenshot_diff_pixels": 0
    },
    {
      "architecture": "amd64",
      "ax_sha256": "def6b05ea534a76b5362a436642f9790e464b4c6489a23118ff60b5eaee3aa1b",
      "completed": true,
      "dom_sha256": "ea28521d6b2e6b6d38b80a3a0411bddfd55da5f015b46271737c21c7f4098bb1",
      "metadata_sha256": "43a98d03b473e29c78ba2d359cf5f39346288d55564e5bfe65bc4a4fd78ebc2c",
      "png_sha256": "5528358e957a6115793155e501f62716f7db31dc1c86856d9e1234868d672837",
      "run": 15,
      "screenshot_diff_pixels": 0
    },
    {
      "architecture": "amd64",
      "ax_sha256": "def6b05ea534a76b5362a436642f9790e464b4c6489a23118ff60b5eaee3aa1b",
      "completed": true,
      "dom_sha256": "ea28521d6b2e6b6d38b80a3a0411bddfd55da5f015b46271737c21c7f4098bb1",
      "metadata_sha256": "43a98d03b473e29c78ba2d359cf5f39346288d55564e5bfe65bc4a4fd78ebc2c",
      "png_sha256": "5528358e957a6115793155e501f62716f7db31dc1c86856d9e1234868d672837",
      "run": 16,
      "screenshot_diff_pixels": 0
    },
    {
      "architecture": "amd64",
      "ax_sha256": "def6b05ea534a76b5362a436642f9790e464b4c6489a23118ff60b5eaee3aa1b",
      "completed": true,
      "dom_sha256": "ea28521d6b2e6b6d38b80a3a0411bddfd55da5f015b46271737c21c7f4098bb1",